Correspondent,Assignors,Assignees,Invention Title,Application Date,Publish Date,Issue Date
ROBERT O. FOX ESQ.,HALSTEAD P. DAVID - ,SOUTHERN IMPACT RESEARCH CENTER LLC - ,BUCKLE,30-05-2001,18-03-2003,
ELIZABETH PARSONS,PHILIPS SEMICONDUCTORS INC. - ,NXP B.V. - ,THERMOSTAT CONTROLS DSP'S TEMPERATURE BY EFFECTUATING THE DSP SWITCHING BETWEEN TASKS OF DIFFERENT COMPUTE-INTENSITY,21-01-1997,09-02-1999,
ELIZABETH PARSONS,PHILIPS SEMICONDUCTORS INC. - ,NXP B.V. - ,MULTIPORT REGISTER FILE TO ACCOMMODATE DATA OF DIFFERING LENGTHS,30-12-1994,09-04-2002,
ELIZABETH PARSONS,PHILIPS SEMICONDUCTORS INC. - ,NXP B.V. - ,VLIW PROCESSING DEVICE INCLUDING IMPROVED MEMORY FOR AVOIDING COLLISIONS WITHOUT AN EXCESSIVE NUMBER OF PORTS,19-04-1995,25-11-1997,
ELIZABETH PARSONS,PHILIPS SEMICONDUCTORS INC. - ,NXP B.V. - ,PLANAR CACHE LAYOUT AND INSTRUCTION STREAM THEREFOR,15-05-1996,10-10-2000,
ELIZABETH PARSONS,PHILIPS SEMICONDUCTORS INC. - ,NXP B.V. - ,COMPILER GENERATING SWIZZLED INSTRUCTIONS USABLE IN A SIMPLIFIED CACHE LAYOUT,15-05-1996,19-01-1999,
ELIZABETH PARSONS,PHILIPS SEMICONDUCTORS INC. - ,NXP B.V. - ,EXCEPTION RECOVERY IN A DATA PROCESSING SYSTEM,16-12-1994,03-11-1998,
ELIZABETH PARSONS,PHILIPS SEMICONDUCTORS INC. - ,NXP B.V. - ,READ CROSSBAR ELIMINATION IN A VLIW PROCESSOR,11-08-1997,03-08-1999,
ELIZABETH PARSONS,PHILIPS SEMICONDUCTORS INC. - ,NXP B.V. - ,VLIW PROCESSOR WHICH USES PATH INFORMATION GENERATED BY A BRANCH CONTROL UNIT TO INHIBIT OPERATIONS WHICH ARE NOT ON A CORRECT PATH,25-10-1993,12-09-1995,
ARTHUR R. CRAWFORD,AFFAITATI PIETRO - FABBRI ANDREA - ,IMS S.R.L. - ,Cold Sterilizer,19-03-2008,23-04-2009,
STAAS & HALSEY LLP,JANG GILJIN - KIM JEONGSU - BRIDLE JOHN S. - HUNT MELVYN J. - ,SAMSUNG ELECTRONICS CO. LTD. - ,METHOD MEDIUM AND SYSTEM DETECTING SPEECH USING ENERGY LEVELS OF SPEECH FRAMES,01-08-2007,07-02-2008,
TIMOTHY J. OYER,HOUSE KURT - AZIZ MICHAEL J. - SCHRAG DANIEL PAUL - ,PRESIDENT AND FELLOWS OF HARVARD COLLEGE - ,TROUGH SHADE SYSTEM AND METHOD,07-11-2008,13-05-2010,13-09-2011,
ANTHONY G. FUSSNER,GRESKO JOHNNY J. - ,DIRECT SOUND HEADPHONES LLC - ,AMBIENT NOISE ISOLATION AUDIO HEADPHONES HAVING A LAYERED DAMPENING STRUCTURE,17-01-2006,14-12-2010,
ANSEL M. SCHWARTZ ATTORNEY AT LAW,NANOPHORETICS LLC - ,DICKERSON SAMUEL J. - CHIARULLI DONALD M. - LEVITAN STEVEN P. - CARTHEL CRAIG - CORALUPPI STEFANO - ,Method and Apparatus for Identifying Objects in a Plurality of Objects Using Dielectrophoresis,04-06-2014,18-12-2014,
DAVID CARRITHERS,BULI TIMMONS - ,ANDERSON WOOD PRODUCTS COMPANY - ,Engineered wood handrail,12-06-2014,15-01-2015,
BAO TRAN,2PHASE TECHNOLOGIES INC. - ,TRAN BAO - ,USE OF STATE-CHANGE MATERIALS IN REFORMABLE SHAPES TEMPLATES OR TOOLING,05-12-2006,16-08-2007,22-07-2008,
LOUIS M HEIDELBERGER,GILMOUR INNOVATIONS LLC - ,CERINET USA INC. - ,BODY-WORN DATA STORAGE DEVICE,11-08-2004,13-01-2005,19-06-2007,
LOUIS M HEIDELBERGER,CERINET USA INC. - ,GILMOUR INNOVATIONS INTELLECTUAL PROPERTY LLC. - ,BODY-WORN DATA STORAGE DEVICE,11-08-2004,13-01-2005,19-06-2007,
COLGATE-PALMOLIVE COMPANY,PILCH SHIRA - MASTERS JAMES GERARD - ,COLGATE-PALMOLIVE COMPANY - ,DENTIFRICE COMPOSITIONS AND METHODS FOR TREATING AND PREVENTING DAMAGE TO TOOTH SURFACES,29-09-2011,02-02-2012,
CANON KABUSHIKI KAISHA,HANABUSA TADASHI - KAWAKAMI KAZUHISA - ,CANON KABUSHIKI KAISHA - ,PRINTING APPARATUS AND METHOD OF RESTRICTING MOVEMENT OF CARRIAGE,16-07-2014,22-01-2015,
CANON KABUSHIKI KAISHA,FUJITA TAKASHI - SAKAI HIROYUKI - SUWA TETSUYA - HASHII YUSUKE - YAMADA AKITOSHI - KATO MASAO - ,CANON KABUSHIKI KAISHA - ,IMAGE PROCESSING APPARATUS AND IMAGE PROCESSING METHOD,11-07-2014,22-01-2015,
KING & SPALDING,JST PERFORMANCE INC. - ,WELLS FARGO BANK NATIONAL ASSOCIATION - ,METHOD AND APPARATUS FOR A LIGHT COLLECTION AND PROJECTION SYSTEM,31-07-2014,05-02-2015,
KING & SPALDING,JST PERFORMANCE INC. - ,WELLS FARGO BANK NATIONAL ASSOCIATION - ,MOUNTABLE ADJUSTABLE VEHICLE LAMP,01-03-2012,06-05-2014,
KING & SPALDING,JST PERFORMANCE INC. - ,WELLS FARGO BANK NATIONAL ASSOCIATION - ,METHOD AND APPARATUS FOR A PROTECTIVE CASE INCLUDING AN OPTICAL SYSTEM,13-01-2014,23-09-2014,
KING & SPALDING,JST PERFORMANCE INC. - ,WELLS FARGO BANK NATIONAL ASSOCIATION - ,VEHICLE LIGHT,07-03-2012,06-05-2014,
KING & SPALDING,JST PERFORMANCE INC. - ,WELLS FARGO BANK NATIONAL ASSOCIATION - ,LANDING LIGHT,16-07-2012,30-04-2013,
KING & SPALDING,JST PERFORMANCE INC. - ,WELLS FARGO BANK NATIONAL ASSOCIATION - ,LIGHT FIXTURE,01-11-2013,08-07-2014,
KING & SPALDING,JST PERFORMANCE INC. - ,WELLS FARGO BANK NATIONAL ASSOCIATION - ,VEHICLE LIGHT FIXTURE,20-02-2013,25-11-2014,
KING & SPALDING,JST PERFORMANCE INC. - ,WELLS FARGO BANK NATIONAL ASSOCIATION - ,Lens System for Lighting Fixture,05-04-2012,10-10-2013,
KING & SPALDING,JST PERFORMANCE INC. - ,WELLS FARGO BANK NATIONAL ASSOCIATION - ,LIGHT FIXTURE WITH CURVED FRAME,14-01-2013,16-01-2014,
KING & SPALDING,JST PERFORMANCE INC. - ,WELLS FARGO BANK NATIONAL ASSOCIATION - ,METHOD AND APPARATUS FOR MARINE-BASED LIGHTING MECHANISMS,07-07-2014,15-01-2015,
KING & SPALDING,JST PERFORMANCE INC. - ,WELLS FARGO BANK NATIONAL ASSOCIATION - ,LED DEVICE WITH POWER REMOVAL DETECTION AND METHOD FOR USING THE SAME,07-09-2011,07-03-2013,05-08-2014,
KING & SPALDING,JST PERFORMANCE INC. - ,WELLS FARGO BANK NATIONAL ASSOCIATION - ,VEHICLE LIGHT WITH FLANGES,01-03-2012,06-05-2014,
KING & SPALDING,JST PERFORMANCE INC. - ,WELLS FARGO BANK NATIONAL ASSOCIATION - ,VEHICLE LED LIGHTING FIXTURE,21-09-2011,20-08-2013,
KOKKA & BACKUS PC,BANKS JANO - BOONE JEFFREY D - BOZARTH BRADLEY - ,RADIIENT TECHNOLOGIES INC. - ,WIRELESS LINK TO TRANSMIT DIGITAL AUDIO DATA BETWEEN DEVICES IN A MANNER CONTROLLED DYNAMICALLY TO ADAPT TO VARIABLE WIRELESS ERROR RATES,15-07-2013,26-06-2014,
KOKKA & BACKUS PC,RADIIENT TECHNOLOGIES INC. - ,ALIPHCOM - ,WIRELESS LINK TO TRANSMIT DIGITAL AUDIO DATA BETWEEN DEVICES IN A MANNER CONTROLLED DYNAMICALLY TO ADAPT TO VARIABLE WIRELESS ERROR RATES,15-07-2013,26-06-2014,
MIN-LEE TENG,YANG CHING-AN - CHIU WEI-TAI - PAN HAN-TSUNG - HSIN LUNG-PIN - JUAN YU-MEI - ,UBRIGHT OPTRONICS CORPORATION - ,OPTICAL SUBSTRATES HAVING LIGHT COLLIMATING AND DIFFUSION STRUCTURES,28-01-2014,28-08-2014,
MIN-LEE TENG,YANG CHING-AN - CHIU WEI-TAI - PAN HAN-TSUNG - HSIN LUNG-PIN - JUAN YU-MEI - ,UBRIGHT OPTRONICS CORPORATION - ,Optical substrates having light collimating and diffusion structures,26-08-2014,18-12-2014,
MIN-LEE TENG,WANG KONG-HUA - LIN CRAIG - KO DANIEL YAW-CHUNG - ,UBRIGHT OPTRONICS CORPORATION - ,MOIRE REDUCING OPTICAL SUBSTRATES WITH IRREGULAR PRISM STRUCTURES,26-08-2013,08-05-2014,
MIN-LEE TENG,LIU NAN-I - PAN HAN-TSUNG - ,UBRIGHT OPTRONICS CORPORATION - ,LUMINANCE ENHANCEMENT FILM HAVING A SUBSTRATE IINCORPORATION DISPERSED PARTICLES FOR DIFFUSION,16-10-2014,29-01-2015,
DAVID E LOEJOY,SRAMEK ROGER A - ,PLUS5 INC - ,WASTE MATERIAL PROCESSING FOR OIL RECOVERY,28-04-2008,29-10-2009,30-08-2011,
JAMES PHILO,L&W INNOVATIONS LLC - ,GAS CAN TECHNOLOGIES LTD. - ,CONTAINER FOR TRANSPORTING AND DISPENSING LIQUIDS,05-11-2007,10-04-2008,24-04-2012,
CHANG-HSING LIANG,LIU SHENG-YUNG - WEN WU-CHE - CHEN CHIH-MING - ,GOLDEN BIOTECHNOLOGY CORPORATION - ,METHODS AND COMPOSITIONS FOR TREATING NEURODEGENERATIVE DISEASES,21-11-2013,22-05-2014,
STEVEN M. AUVIL,EAGLEPICHER TECHNOLOGIES LLC - OMG ELECTRONIC CHEMICALS LLC - OMG AMERICAS INC. - EAGLEPICHER MEDICAL POWER LLC - COMPUGRAPHICS U.S.A. INC. - ,PNC BANK NATIONAL ASSOCIATION - ,METHOD OF FABRICATING AN ELECTROLYTIC CELL EMPLOYING A SOLID POLYMER ELECTROLYTE,16-03-2001,02-08-2001,06-05-2003,
STEVEN M. AUVIL,EAGLEPICHER TECHNOLOGIES LLC - OMG ELECTRONIC CHEMICALS LLC - OMG AMERICAS INC. - EAGLEPICHER MEDICAL POWER LLC - COMPUGRAPHICS U.S.A. INC. - ,PNC BANK NATIONAL ASSOCIATION - ,SUPERCAPACITOR HAVING ELECTRODES WITH NON-ACTIVATED CARBON FIBERS,21-05-1993,03-12-1996,
STEVEN M. AUVIL,EAGLEPICHER TECHNOLOGIES LLC - OMG ELECTRONIC CHEMICALS LLC - OMG AMERICAS INC. - EAGLEPICHER MEDICAL POWER LLC - COMPUGRAPHICS U.S.A. INC. - ,PNC BANK NATIONAL ASSOCIATION - ,COMPOSITE CURRENT COLLECTOR METHODS OF MANUFACTURE THEREOF AND ARTICLES INCLUDING THE SAME,10-06-2011,13-12-2012,
STEVEN M. AUVIL,EAGLEPICHER TECHNOLOGIES LLC - OMG ELECTRONIC CHEMICALS LLC - OMG AMERICAS INC. - EAGLEPICHER MEDICAL POWER LLC - COMPUGRAPHICS U.S.A. INC. - ,PNC BANK NATIONAL ASSOCIATION - ,NEGATIVE ELECTRODE MATERIAL FOR NONAQUEOUS ELECTROCHEMICAL CELLS,11-10-2002,03-04-2003,26-10-2004,
STEVEN M. AUVIL,EAGLEPICHER TECHNOLOGIES LLC - OMG ELECTRONIC CHEMICALS LLC - OMG AMERICAS INC. - EAGLEPICHER MEDICAL POWER LLC - COMPUGRAPHICS U.S.A. INC. - ,PNC BANK NATIONAL ASSOCIATION - ,BIPOLAR LITHIUM-ION RECHARGEABLE BATTERY,01-06-1995,21-01-1997,
STEVEN M. AUVIL,EAGLEPICHER TECHNOLOGIES LLC - OMG ELECTRONIC CHEMICALS LLC - OMG AMERICAS INC. - EAGLEPICHER MEDICAL POWER LLC - COMPUGRAPHICS U.S.A. INC. - ,PNC BANK NATIONAL ASSOCIATION - ,NON-AQUEOUS ELECTROLYTES FOR LITHIUM ELECTROCHEMICAL CELLS,07-11-2002,12-06-2003,08-02-2005,
STEVEN M. AUVIL,EAGLEPICHER TECHNOLOGIES LLC - OMG ELECTRONIC CHEMICALS LLC - OMG AMERICAS INC. - EAGLEPICHER MEDICAL POWER LLC - COMPUGRAPHICS U.S.A. INC. - ,PNC BANK NATIONAL ASSOCIATION - ,RECHARGEABLE ALKALINE SILVER- ZINC CELL WITH IMPROVED NEGATIVE ELECTRODE,02-10-1996,30-06-1998,
STEVEN M. AUVIL,EAGLEPICHER TECHNOLOGIES LLC - OMG ELECTRONIC CHEMICALS LLC - OMG AMERICAS INC. - EAGLEPICHER MEDICAL POWER LLC - COMPUGRAPHICS U.S.A. INC. - ,PNC BANK NATIONAL ASSOCIATION - ,PROCESS FOR MANUFACTURING SUPER CAPACITOR,10-04-1996,22-07-1997,
STEVEN M. AUVIL,EAGLEPICHER TECHNOLOGIES LLC - OMG ELECTRONIC CHEMICALS LLC - OMG AMERICAS INC. - EAGLEPICHER MEDICAL POWER LLC - COMPUGRAPHICS U.S.A. INC. - ,PNC BANK NATIONAL ASSOCIATION - ,LIQUID RETAINING PRESSURE RELIEF VALVE FOR BATTERY CELLS,18-03-2005,22-09-2005,23-08-2011,
STEVEN M. AUVIL,EAGLEPICHER TECHNOLOGIES LLC - OMG ELECTRONIC CHEMICALS LLC - OMG AMERICAS INC. - EAGLEPICHER MEDICAL POWER LLC - COMPUGRAPHICS U.S.A. INC. - ,PNC BANK NATIONAL ASSOCIATION - ,INORGANIC GEL-POLYMER ELECTROLYTE,15-03-2001,09-08-2001,29-07-2003,
BARNES & THORNBURG LLP,PADANA AG - ,DANZER SERVICES SCHWEIZ AG - ,FLITCH TABLE MOUNTING,08-06-1999,15-08-2000,
BARNES & THORNBURG LLP,PADANA AG - ,DANZER SERVICES SCHWEIZ AG - ,Automatic clipping line,20-06-2006,20-12-2007,
BARNES & THORNBURG LLP,PADANA AG - ,DANZER SERVICES SCHWEIZ AG - ,METHOD AND APPARATUS FOR PRODUCING FIGURED VENEER,12-07-2012,03-01-2013,07-10-2014,
BARNES & THORNBURG LLP,PADANA AG - ,DANZER SERVICES SCHWEIZ AG - ,CROSSCLIPPING AND BUNDLING SYSTEM AND METHOD FOR VENEER PACKETS,04-08-2010,20-01-2011,
BARNES & THORNBURG LLP,PADANA AG - ,DANZER SERVICES SCHWEIZ AG - ,VENEER SLICER,11-06-1998,09-11-1999,
MARYELLEN FEEHERY HANK,BENJAMIN MOORE & CO. - ,COLUMBIA INSURANCE COMPANY - ,PAINTS WITH IMPROVED WATER STAINING AND COLOR RUB-OFF QUALITIES,11-12-2012,28-03-2013,
WAYNE L. TANG,AOKI DION K. - ENGLMAN ALLON G. - JAFFE JOEL R. - ,WMS GAMING INC. - ,MULTI-GAME VIDEO POKER MACHINE AND SYSTEM WITH ASYMMETRICALLY ACCESSIBLE CUSTOMIZATION FEATURES,25-11-2013,27-03-2014,
MIDDLETON REUTLINGER,E. I. DU PONT DE NEMOURS AND COMPANY - ,JACOB HOLM & SONS AG - ,Biodegradable Landscape Fabric,19-07-2012,18-07-2013,
LEMPIA SUMMERFIELD KATZ LLC,HEALD JONATHAN RODERIC - ,HEALD TECHNOLOGIES LTD. - ,Security Barrier,06-02-2013,15-08-2013,
ARTHUR A. GARDNER,MCDAVITT DANIEL L. - ,L-3 COMMUNICATIONS CORPORATION - ,BACKLIGHT DISPLAY USING PHOTOLUMINESCENT MATERIAL TUNED TO IMPROVE NVIS COMPATIBILITY,07-03-2013,12-09-2013,
PEREGRINE PHARMACEUTICALS INC.,BOARD OF REGENTS THE UNIVERSITY OF TEXAS SYSTEM - ,NATIONAL INSTITUTES OF HEALTH (NIH) U.S. DEPT. OF HEALTH AND HUMAN SERVICES (DHHS) U.S. GOVERNMENT - ,DIAGNOSTIC METHODS  FOR TARGETING THE VASCULATURE OF SOLID TUMORS,08-12-1998,17-07-2001,
MUNCY GEISSLER OLDS & LOWE P.C.,GUTER WOLFGANG - ,AZUR SPACE SOLAR POWER GMBH - ,SOLAR CELL STACK,14-10-2014,05-02-2015,
MAYBACK & HOFFMAN P.A.,UUNIQUUE SECUURITY SOLUTIONS LLC - ,VISUUM LLC - ,MULTI-LINEAR X-RAY SCANNING SYSTEMS AND METHODS FOR X-RAY SCANNING,07-02-2013,08-08-2013,
KACVINSKY DAISAK BLUNI PLLC,MACDONALD MARK - HEYMANN DOUGLAS - WIKANDER JERED H. - NISHI YOSHIFUMI - ,INTEL CORPORATION - ,TECHNIQUES FOR IMPROVED VOLUMETRIC RESISTANCE BLOWER APPARATUS SYSTEM AND METHOD,28-06-2013,01-01-2015,
BLACKBERRY LIMITED - JAMIE-LYN,8758271 CANADA INC. - ,2236008 ONTARIO INC. - ,OFF-AXIS AUDIO SUPPRESSIONS IN AN AUTOMOBILE CABIN,06-08-2014,27-11-2014,
PEREGRINE PHARMACEUTICALS INC.,BOARD OF REGENTS THE UNIVERSITY OF TEXAS SYSTEM - ,NATIONAL INSTITUTES OF HEALTH (NIH) U.S. DEPT. OF HEALTH AND HUMAN SERVICES (DHHS) U.S. GOVERNMENT - ,METHODS FOR TARGETING THE VASCULATURE OF SOLID TUMORS,01-06-1995,07-07-1998,
ANDREW B. ULMER,CARPER KENNETH E. - GEIGER DANIEL L. - LEHR KYLE A. - ,ITE LLC - ,INFLATOR FOR DILATION OF ANATOMICAL PASSAGEWAY,09-09-2013,13-03-2014,
HANLEY FLIGHT & ZIMMERMAN LLC,ECKERT FRANK - ,DUERR CYPLAN LTD. - ,TURBOMACHINES HAVING GUIDE DUCTS,30-04-2014,21-08-2014,
NATIONAL SCIENCE FOUNDATION,COLORADO STATE UNIVERSITY RESEARCH FOUNDATION - ,NATIONAL SCIENCE FOUNDATION - ,POLYMERIC MATERIALS INCLUDING A GLYCOSAMINOGLYCAN NETWORKED WITH A POLYOLEFIN-CONTAINING POLYMER,08-07-2012,18-10-2012,
MAIER & MAIER PLLC,NEMTRA GMBH - ,CHUNGA UG (HAFTUNGSBESCHRANKT) - ,AEROSOL-FORMING MATERIAL FOR A HOOKAH,25-06-2014,16-10-2014,
NOVO NORDISK INC.,STENNICKE VIBEKE WESTPHAL - HENRIKSEN ANETTE - ANDERSEN METTE DAHL - ,NOVO NORDISK A/S - ,NOVEL RECEPTOR TREM (TRIGGERING RECEPTOR EXPRESSED ON MYELOID CELLS) AND USES THEREOF,30-11-2012,13-06-2013,
GERARD A. MESSINA,HENRICI FABIAN - WENZLER AXEL - SCHIEMANN WERNER - SCHNITZER REINER - ELBRACHT BERTHOLD - ,ROBERT BOSCH GMBH - ,BATTERY SENSOR DATA TRANSMISSION UNIT AND A METHOD FOR TRANSMITTING BATTERY SENSOR DATA,15-08-2014,08-01-2015,
SCHWEGMAN LUNDBERG & WOESSNER P.A.,GOULD HELEN M. - GARCIA EDWARD O'NEIL - MELCHER RYAN - LAGUNAS DIEGO - BOLIVAR ALVARO - ANDERSON JENNIFER T. - SUSILO KARENINA - SPOON RYAN - LEWIS ALAN - ,EBAY INC. - ,METHOD AND SYSTEM FOR COLLABORATIVE AND PRIVATE SESSIONS,23-02-2011,16-06-2011,16-12-2014,
DAVID J. GASKEY,HANCOCK MATTHEW - ROBINSON GUY - ,JAGUAR LAND ROVER LIMITED - ,MOTOR VEHICLE CONTROLLER AND METHOD OF CONTROLLING A MOTOR VEHICLE,29-07-2014,18-12-2014,
DIEDERIKS & WHITELAW PLC,ROEPER HARTMUT - ,FORD GLOBAL TECHNOLOGIES LLC - ,SYNCHRONIZATION DEVICE,17-03-2014,27-11-2014,
BERNARD F. PLANTZ,DEPUY PRODUCTS INC. - ,DEPUY SPINE LLC - ,METHOD OF FABRICATING CUSTOMIZED PATIENT-SPECIFIC BONE CUTTING BLOCKS,21-08-2012,14-03-2013,
JOHN T. WHELAN,SIMON SASCHA - ,APIO SYSTEMS INC. - ,SYSTEM AND METHOD FOR DETECTING VEHICLE CRASH,13-12-2013,26-06-2014,
BERNARD F. PLANTZ,DEPUY SPINE LLC - ,HAND INNOVATIONS LLC - ,METHOD OF FABRICATING CUSTOMIZED PATIENT-SPECIFIC BONE CUTTING BLOCKS,21-08-2012,14-03-2013,
BETTY G. SMITH SENIOR PARALEGAL,SYMETRICS TECHNOLOGY GROUP LLC - ,WELLS FARGO BANK NATIONAL ASSOCIATION AS ADMINISTRATIVE AGENT - ,Modular sensor array,29-05-2001,05-12-2002,
BETTY G. SMITH SENIOR PARALEGAL,SYMETRICS TECHNOLOGY GROUP LLC - ,WELLS FARGO BANK NATIONAL ASSOCIATION AS ADMINISTRATIVE AGENT - ,PORTABLE TERMINAL,15-06-1990,04-08-1992,
EDNA I. GERGEL,JUNG SEUNG-YONG - ,OAK RIDGE ASSOCIATED UNIVERSITIES - ,GENERATION OF MONODISPERSE DROPLETS BY SHAPE-INDUCED SHEAR AND INTERFACIAL CONTROLLED FUSION OF INDIVIDUAL DROPLETS ON-DEMAND,15-06-2011,20-12-2012,03-02-2015,
WHITHAM CURTIS & CHRISTOFFERSON & COOK,TERZI FABIOLA - CANAUD GUILLAUME - BIENAIME FRANK - ,INSERM (INSTITUT NATIONAL DE LA SANTE ET DE LA RECHERCHE MEDICALE) - ,BIOMARKERS OF RENAL DISORDERS,14-04-2014,15-01-2015,
EDNA I. GERGEL,OAK RIDGE ASSOCIATED UNIVERSITIES - ,UT-BATTELLE LLC - ,GENERATION OF MONODISPERSE DROPLETS BY SHAPE-INDUCED SHEAR AND INTERFACIAL CONTROLLED FUSION OF INDIVIDUAL DROPLETS ON-DEMAND,15-06-2011,20-12-2012,03-02-2015,
ALSTON & BIRD LLP,MORAES AURÉLIO ROTOLO - ,AUDIOBRAX INDÚSTRIA E COMÉRCIO DE PRODUTOS ELETRÔNICOS S/A - ,Mobile Communication Device with Musical Instrument Functions,29-02-2008,16-10-2008,
ERIC R. WALDKOETTER,GEJDOS IGOR - ,ROCHE DIAGNOSTICS OPERATIONS INC. - ,DYNAMIC COMMUNICATION STACK,01-03-2013,18-07-2013,
BANNER & WITCOFF LTD.,MURODATE YUSUKE - KOBAYASHI AKIHIRO - HAZEYAMA TOMOAKI - IWATA NAOYUKI - MARUYAMA YASUHIRO - NISHIGAKI YUJI - ,BROTHER KOGYO KABUSHIKI KAISHA - ,FIXING DEVICE PROVIDED WITH REINFORCED NIP MEMBER,27-03-2014,02-10-2014,
AKAMAI TECHNOLOGIES INC.,LISIECKI PHILIP A. - NICOLAOU COSMOS - ROSE KYLE R. - ,AKAMAI TECHNOLOGIES INC. - ,SCALABLE HIGH PERFORMANCE AND HIGHLY AVAILABLE DISTRIBUTED STORAGE SYSTEM FOR INTERNET CONTENT,20-05-2013,26-09-2013,
GLOBUS MEDICAL INC.,ANKNEY DAVID - RHODA WILLIAM - PAUL DAVID C. - ANGELUCCI CHRISTOPHER - ,GLOBUS MEDICAL INC. - ,Transforaminal Prosthetic Spinal Disc Replacement and Methods Thereof,08-05-2013,20-02-2014,
ARNOLD & PORTER LLP,GABBERT KAREN K. - IANDOLINO ALBERTO - JIA HONGWU - KOSOLA KEVIN R. - LOIDA PAUL J. - LUTFIYYA LINDA L. - PRASAD BELLUR NARASIMHA - RAJANI MONNANDA S. - RAVANELLO MONICA P. - TODD DONALD M. - VENKATACHALAYYA SRIKANTH BABU - VENKATESH TYAMAGONDLU V. - VIDYA K. R. - ,MONSANTO TECHNOLOGY LLC - ,Transgenic Plants with Enhanced Agronomic Traits,06-11-2012,06-06-2013,
SCHWEGMAN LUNDBERG & WOESSNER P.A.,VON KROGH CHRISTOPHER JURGEN - ,EBAY INC. - ,ONE TIME PASSWORD AUTHENTICATION OF WEBSITES,14-09-2012,10-01-2013,
HAMRE SCHUMANN MUELLER & LARSON P.C.,Q CHIP LIMITED - ,MIDATECH PHARMA (WALES) LIMITED - ,BEAD COLLECTION DEVICE AND METHOD,28-03-2014,24-07-2014,
HAMRE SCHUMANN MUELLER & LARSON P.C.,Q CHIP LIMITED - ,MIDATECH PHARMA (WALES) LIMITED - ,METHOD FOR MAKING SOLID BEADS,13-06-2013,03-10-2013,
HAMRE SCHUMANN MUELLER & LARSON P.C.,Q CHIP LIMITED - ,MIDATECH PHARMA (WALES) LIMITED - ,APPARATUS AND METHOD FOR MAKING SOLID BEADS,13-06-2013,03-10-2013,
CPA GLOBAL LIMITED,MITSUBISHI HEAVY INDUSTRIES LTD. - ,MITSUBISHI HITACHI POWER SYSTEMS LTD. - ,PREMIXED COMBUSTION BURNER OF GAS TURBINE TECHNICAL FIELD,27-04-2007,26-06-2008,01-02-2011,
JAMES W. BABINEAU,WALLMEROTH KLAUS  - SCHMITZ CHRISTIAN  - ,TRUMPF LASER GMBH - TRUMPF LASER- UND SYSTEMTECHNIK GMBH - ,METHOD FOR FORMING A COMPOSITE MATERIAL AND HEAT SINK,17-01-2014,05-06-2014,
SCHWEGMAN LUNDBERG & WOESSNER P.A.,DIJK BOB VAN - HAAK WOUTER - LETTINGA ROELOF - ,EBAY INC. - ,SYSTEM AND METHOD FOR CATEGORY-BASED CONTEXTUAL ADVERTISEMENT GENERATION AND MANAGEMENT,31-12-2008,09-07-2009,
BLANK ROME LLP,ROOT STEVEN A. - ROOT MICHAEL A. - ,WEATHERBANK INC. - ,INTERACTIVE ADVISORY SYSTEM,15-01-2014,24-07-2014,
ANDREW B. ULMER,JOHNSON GREGORY W. - SWAYZE JEFFREY S. - KIMBALL CORY G. - ,ETHICON ENDO-SURGERY INC. - ,INFLATOR FOR DILATION OF ANATOMICAL PASSAGEWAY,09-09-2013,13-03-2014,
BLANK ROME LLP,WEATHERBANK INC. - ,LOCATOR IP LP - ,INTERACTIVE ADVISORY SYSTEM,15-01-2014,24-07-2014,
JOHN HE,TSENG YING-JUNG - ,STARJET TECHNOLOGIES CO. LTD - ,Firing device of an airsoft gun,22-07-2013,22-01-2015,
JOSEPH P. BOOS,ULLMAN DAVID G. - NASON D. DAVID - KLASEN MICHAEL G. - LAZAR RICHARD A. - ,ROBUST DECISIONS INC. - ,MULTI-FUNCTION SEARCHING AND SEARCH-RELATED TOOLS AND TECHNIQUES FOR IMPROVED SEARCH RESULTS AND ENHANCED ANALYSIS AND DECISION-MAKING,29-08-2013,06-03-2014,
SCHWEGMAN LUNDBERG & WOESSNER P.A.,GUPTA RAGHAV - XU SICHUN - ,EBAY INC. - ,DETERMINING RELEVANCY AND DESIRABILITY OF TERMS,30-06-2009,21-01-2010,12-06-2012,
ARNOLD & PORTER LLP,ALLEN EDWARDS - ANIL VEENA S. - BHAT PRASANNA - CHITTOOR JAISHREE - GRIFFITH CARA L. - HENDRIX BILL L. - LOIDA PAUL - RAJANI MONNANDA S. - VENKATESH TYAMAGONDLU V. - WANG HUAI - ,MONSANTO TECHNOLOGY LLC - ,Transgenic Plants with Enhanced Agronomic Traits,06-11-2012,06-06-2013,
MARK J. PANDISCIO,PRO MAGS LLC - ,HESLA RON - ,GAUGE WHEEL AND UNIVERSAL SCRAPER FOR USE WITH A CONVENTIONAL ROW PLANTER ASSEMBLY,03-04-2013,16-01-2014,
STEPHEN A. GIGOT,DIMIG STEVEN J. - BEHRENS JON W. - FINK MICHAEL D. - ,STRATTEC SECURITY CORPORATION - ,STEERING LOCK,08-09-2014,25-12-2014,
ANDREW B. ULMER,HENRY EMRON J. - ,KALEIDOSCOPE INC. - ,INFLATOR FOR DILATION OF ANATOMICAL PASSAGEWAY,09-09-2013,13-03-2014,
ARNOLD & PORTER LLP,BASRA AMARJIT - BAUER CHRISTOPHER - CHARI RAGHUNATHA - CHOMET PAUL - IANDOLINO ALBERTO - JIA HONGWU - KURIAKOSE SARITHA - PENG MINGSHENG - PENG YING - RAJANI SOMAIAH - ,MONSANTO TECHNOLOGY LLC - ,Transgenic Plants with Enhanced Agronomic Traits,06-11-2012,06-06-2013,
SCHWEGMAN LUNDBERG & WOESSNER P.A.,REITTER ALEC - CHANG BARBARA - SUN KEN - GUPTA RAGHAV - BOLIVAR ALVARO - LEWIS ALAN - ,EBAY INC. - ,SYSTEM AND METHOD FOR APPLICATION PROGRAMMING INTERFACES FOR KEYWORD EXTRACTION AND CONTEXTUAL ADVERTISEMENT GENERATION,05-11-2010,03-03-2011,12-06-2012,
ANDREW B. ULMER,KALEIDOSCOPE INC. - ,ETHICON ENDO-SURGERY INC. - ,INFLATOR FOR DILATION OF ANATOMICAL PASSAGEWAY,09-09-2013,13-03-2014,
AMERICAN AIR LIQUIDE INC.,ABE ISAO - TOMITA SHINJI - ,L'AIR LIQUIDE SOCIETE ANONYME POUR L'ETUDE ET L'EXPLOITATION DES PROCEDES GEORGES CLAUDE - ,PROCESS FOR SEPARATING MONOSILANE FROM CHLOROSILANES-RICH MIXTURE,01-03-2013,20-06-2013,
WELLS FARGO BANK N. A.,WELLS FARGO BANK NATIONAL ASSOCIATION - ,SOLID STATE EQUIPMENT HOLDINGS LLC - ,WAFER SCRUBBING DEVICE,14-06-1996,14-10-1997,
WELLS FARGO BANK N. A.,WELLS FARGO BANK NATIONAL ASSOCIATION - ,SOLID STATE EQUIPMENT HOLDINGS LLC - ,Wet etching of the edge and bevel of a silicon wafer,18-06-2008,27-11-2008,
BIRCH STEWART KOLASCH & BIRCH LLP,ASAN LABORATORIES COMPANY (CAYMAN) LIMITED - ,SUNNY PHARMTECH INC - ,METHOD FOR TREATING OR AMELIORATING MUCOCUTANEOUS OR OCULAR TOXICITIES,29-11-2011,10-05-2012,
ANDREW B. ULMER,NEWELL MATTHEW B. - CLAUSON LUKE W. - ,INNOVATIVE DRIVE CORPORATION - ,INFLATOR FOR DILATION OF ANATOMICAL PASSAGEWAY,09-09-2013,13-03-2014,
HERBERT R. SCHULZE,ARGON TECHNOLOGIES INC. - ,NUDOWN INC. - ,SYSTEMS AND METHODS FOR INFLATING AN ARTICLE OF OUTDOOR GEAR OR APPAREL USING A DRY GAS,06-09-2011,16-02-2012,
MICHAEL LEINAUER ICE MILLER LLP,MILLER GARY E. - ,MILLER GARY E. - MILLER BARBARA J. - ,VARIOUSLY CONFIGURABLE ROTATING BIOLOGICAL CONTACTOR AND PREFABRICATED COMPONENTS THEREFOR,19-05-2004,24-11-2005,01-08-2006,
SCHWEGMAN LUNDBERG & WOESSNER P.A.,SUNDARESAN NEELAKANTAN - ,EBAY INC. - ,CONFIGURABLE INTERFACES,02-09-2010,08-03-2012,
LUCAS & MERCANTI LLP/ YUN H. CHOE,UBMATERIALS INC. - ,INDUSTRIAL BANK OF KOREA - ,CMP SLURRY COMPOSITION FOR TUNGSTEN,25-10-2012,22-08-2013,
WOLF GREENFIELD & SACKS P.C.,RADZIUNAS JEFFREY P. - DICESARE PAUL C - ,START LLC - ,ENDOSCOPIC SUTURING DEVICE,18-10-2011,02-02-2012,11-11-2014,
ECKERT SEAMANS CHERIN & MELLOTT LLC,HUI YI MING - WANG ZHI - ,DONGGUAN YIXIN MAGNETIC DISK CO. LTD. - ,PORTABLE CHARGEABLE SPRAY BOTTLE,24-06-2011,22-12-2011,
LEXYOUME IP MEISTER PLLC,SEJIN INNOTECH CO. LTD - ,SJ MATERIALS CO. LTD - ,CATHODE ACTIVE MATERIAL FOR LITHIUM SECONDARY BATTERY METHOD OF MANUFACTURING THE SAME AND LITHIUM SECONDARY BATTERY INCLUDING THE SAME,26-09-2013,30-01-2014,
TEXAS INSTRUMENTS INCORPORATED,GURUMURTHY GIRISHANKAR - VASISHTA MAHESH RAMDAS - ,TEXAS INSTRUMENTS INCORPORATED - ,LOW CLOCK-POWER INTEGRATED CLOCK GATING CELL,25-11-2013,03-07-2014,
SCHWEGMAN LUNDBERG & WOESSNER P.A.,LEE JANET - MELNICK ANDREW - YANG ZHENYIN - PETKOV GEORGE B. - TREGAN LOIC - CEMBALLI GUNSHEKAR - JAIN BHUPENDRA - AHMED GHUFRAN - IANNONE JAMIE - RANNALA ERIK - SIDANA ANNUPREET - SUBRAMANIAM VIKRAM - ,EBAY INC. - ,POINT-OF-SALE PROMOTIONS,28-06-2011,20-10-2011,11-06-2013,
R. JOSEPH TROJAN,KINMON KYLE - ,AFCN LLC - ,INTRAMEDULLARY NAIL SYSTEM AND METHOD WITH DYNAMIC COMPRESSION,24-11-2011,24-05-2012,04-11-2014,
HUNTON & WILLIAMS LLP,CHASSET SOPHIE - CHEVREUIL FRANCIS - LEDOUSSAL BENOIT - LE STRAT FRÉDÉRIC - BENAROUS RICHARD - ,LABORATOIRE BIODIM - ,INHIBITORS OF VIRAL REPLICATION THEIR PROCESS OF PREPARATION AND THEIR THERAPEUTICAL USES,07-10-2013,08-05-2014,
WHITHAM CURTIS CHRISTOFFERSON & COOK,INSERM (INSTITUT NATIONAL DE LA SANTE ET DE LA RECHERCHE MEDICALE) - ,INSERM (INSTITUT NATIONAL DE LA SANTE ET DE LA RECHERCHE MEDICALE) - UNIVERSITE PIERRE ET MARIE CURIE (PARIS 6) - CENTRE NATIONAL DE LA RECHERCHE SCIENTIFIQUE (CNRS) - ,METHODS AND COMPOSITIONS FOR TREATMENT OF RETINAL DEGENERATIVE DISEASES,22-08-2014,05-02-2015,
B. J. SADOFF,HAHN BEATRICE H. - ,THE UNIVERSITY OF ALABAMA AT BIRMINGHAM RESEARCH FOUNDATION - ,HUMAN IMMUNODEFICIENCY VIRUS TYPE 1 CLADE M MOSAIC GAG POLYPEPTIDES.,17-02-2012,13-09-2012,
LEXYOUME IP MEISTER PLLC,SEJIN INNOTECH CO. LTD - ,SJ MATERIALS CO. LTD - ,POROUS SILICON BASED NEGATIVE ELECTRODE ACTIVE MATERIAL METHOD FOR MANUFACTURING THE SAME AND RECHARGEABLE LITHIUM BATTERY INCLUDING THE SAME,20-06-2014,25-12-2014,
ANDREW B. ULMER,INNOVATIVE DRIVE CORPORATION - ,ACCLARENT INC. - ,INFLATOR FOR DILATION OF ANATOMICAL PASSAGEWAY,09-09-2013,13-03-2014,
LEE HONG DEGERMAN KANG & WAIMEY,CHIE SUNG KYU - ,LG ELECTRONICS INC. - ,METHOD OF PROCESSING RADIO FREQUENCY SIGNAL IN MOBILE TERMINAL AND MOBILE COMMUNICATION SYSTEM AND MOBILE TERMINAL USING THE SAME,19-01-2007,26-07-2007,
CONLEY ROSE P.C./MATTHEW R. MOSCICKI,MADHAVAN RAGHU - BOYLE BRUCE W. - CLARK BRIAN - ,SCHLUMBERGER TECHNOLOGY CORPORATION - ,METHOD AND CONDUIT FOR TRANSMITTING SIGNALS,31-12-2012,23-05-2013,
SCOTT BARDELL,MEDTRONIC CORVENTIS INC. - ,MEDTRONIC MONITORING INC. - ,Chiropractic Care Management Systems and Methods,19-05-2009,26-11-2009,
SCOTT BARDELL,MEDTRONIC CORVENTIS INC. - ,MEDTRONIC MONITORING INC. - ,Tracking and Security for Adherent Patient Monitor,12-09-2008,19-03-2009,
SCOTT BARDELL,MEDTRONIC CORVENTIS INC. - ,MEDTRONIC MONITORING INC. - ,Communication-Anchor Loop For Injectable Device,27-07-2009,29-07-2010,
SCOTT BARDELL,MEDTRONIC CORVENTIS INC. - ,MEDTRONIC MONITORING INC. - ,Method and Apparatus For Acute Cardiac Monitoring,25-08-2009,04-03-2010,
SCOTT BARDELL,MEDTRONIC CORVENTIS INC. - ,MEDTRONIC MONITORING INC. - ,Method and Apparatus for Monitoring Fluid Content within Body Tissues,12-03-2010,16-09-2010,
SCHWEGMAN LUNDBERG & WOESSNER P.A.,SUNDARESAN NEELAKANTAN - REITTER ALEC - ,EBAY INC. - ,SHOPPING CONTEXT ENGINE,09-05-2012,30-08-2012,20-08-2013,
