Correspondent,Assignors,Assignees,Invention Title,Application Date,Publish Date,Issue Date
ERIN O'BRIEN,VENCORE SOLUTIONS LLC - ,MAGNIFY NETWORKS INC. - ,Method of and a system for logging on a project which contains a footage,25-11-2005,09-08-2007,
ERIN O'BRIEN,VENCORE SOLUTIONS LLC - ,MAGNIFY NETWORKS INC. - ,Method of and a system for accepting user-created content on a computer network site,03-10-2005,12-07-2007,
ERIN O'BRIEN,VENCORE SOLUTIONS LLC - ,MAGNIFY NETWORKS INC. - ,HOSTED VIDEO DISCOVERY AND PUBLISHING PLATFORM,05-07-2007,28-02-2008,14-02-2012,
JOHN A. FORTKORT,7 BILLION PEOPLE INC. - ,HERITAGE OPPORTUNITY FUND LLC - ,System for creating customized web content based on user behavioral portraits,31-01-2008,21-08-2008,
JOHN A. FORTKORT,7 BILLION PEOPLE INC. - ,HERITAGE OPPORTUNITY FUND LLC - ,Use of behavioral portraits in web site analysis,31-01-2008,18-09-2008,
JOHN A. FORTKORT,7 BILLION PEOPLE INC. - ,HERITAGE OPPORTUNITY FUND LLC - ,Use of behavioral portraits in the conduct of E-commerce,31-01-2008,21-08-2008,
JOHN A. FORTKORT,7 BILLION PEOPLE INC. - ,HERITAGE OPPORTUNITY FUND LLC - ,Dynamic Reconfiguration of Web Pages Based on User Behavioral Portrait,17-01-2014,17-07-2014,
JOHN A. FORTKORT,7 BILLION PEOPLE INC. - ,HERITAGE OPPORTUNITY FUND LLC - ,Use of Behavioral Portraits in Web Site Analysis,17-01-2014,31-07-2014,
JOHN A. FORTKORT,7 BILLION PEOPLE INC. - ,HERITAGE OPPORTUNITY FUND LLC - ,DYNAMIC RECONFIGURATION OF WEB PAGES BASED ON USER BEHAVIORAL PORTRAIT,31-01-2008,21-08-2008,06-05-2014,
JOHN A. FORTKORT,7 BILLION PEOPLE INC. - ,HERITAGE OPPORTUNITY FUND LLC - ,System for Creating Customized Web Content Based on User Behavioral Portraits,19-10-2011,09-02-2012,04-03-2014,
JOHN A. FORTKORT,7 BILLION PEOPLE INC. - ,HERITAGE OPPORTUNITY FUND LLC - ,USE OF BEHAVIORAL PORTRAITS IN WEB SITE ANALYSIS,19-10-2011,09-02-2012,25-03-2014,
B. J. SADOFF,LETVIN NORMAN - ,BETH ISRAEL DEACONESS MEDICAL CENTER - ,HUMAN IMMUNODEFICIENCY VIRUS TYPE 1 CLADE M MOSAIC GAG POLYPEPTIDES.,17-02-2012,13-09-2012,
LEMPIA SUMMERFIELD KATZ LLC,HAIDER SULTAN - KREISCHER LUDWIG - ,SIEMENS AKTIENGESELLSCHAFT - ,Patient Transport System,04-07-2014,08-01-2015,
LEMPIA SUMMERFIELD KATZ LLC,LAZAR RAZVAN - SCHRAMM MARTIN - ,SIEMENS AKTIENGESELLSCHAFT - ,Mounting for a Body Coil of a Magnetic Resonance Device,26-06-2014,01-01-2015,
SCHWEGMAN LUNDBERG & WOESSNER P.A.,SHAH DIMPLE B. - TERACHI TAKATSUGU - ,EBAY INC. - ,METHODS AND APPARATUS FOR FUNDING TRANSACTIONS USING DEBIT CARDS ISSUED BY ONE INSTITUTION AND FUNDS FROM ACCOUNTS AT OTHER INSTITUTIONS,20-08-2012,13-12-2012,05-03-2013,
CONLEY ROSE P.C.,CRONIN PAUL J. - WILDEY CHESTER - HUNT ALAN K. - ,AUTHENTIX INC. - ,OBJECT AUTHENTICATION,04-06-2012,04-10-2012,01-10-2013,
SCHWEGMAN LUNDBERG & WOESSNER P.A.,SUNDARESAN NEELAKANTAN - ,EBAY INC. - ,COMMUNITY BASED NETWORK SHOPPING,27-07-2011,31-01-2013,22-04-2014,
SHUMAKER & SIEFFERT P.A.,NESAMONEY DIAZ H. - MARTIN JAMEISON B. - RADALJ MAURICE M. - YOUNAS FAYYAZ A. - ,INTERNATIONAL BUSINESS MACHINES CORPORATION - ,METHOD FOR PROVIDING A REAL TIME VIEW OF HETEROGENEOUS ENTERPRISE DATA,08-08-2013,06-02-2014,
MICHAEL BEST & FRIEDRICH LLP,STEELE MICHAEL S. - HYMA STEVEN W. - ,MILWAUKEE ELECTRIC TOOL CORPORATION - ,STAPLER,19-02-2014,21-08-2014,
ELIZABETH ARWINE,BERGLUND LARRY G - HOYT REED W - ,U.S. ARMY MEDICAL RESEARCH AND MATERIEL COMMAND - ,PROTECTIVE CLOTHING ENSEMBLE WITH TWO-STAGE EVAPORATIVE COOLING,01-03-2013,11-07-2013,
SOLVAY USA INC.,CHEMPLEX ADVANCED MATERIALS LLC - VENTANA RESOURCES MANAGEMENT LLC - CHEMLOGICS GROUP LLC - SOLVAY USA INC. - ,SOLVAY USA INC. - ,IRON CONTROL AGENT,09-11-2005,23-08-2011,
B. J. SADOFF,KORBER BETTE T. - PERKINS SIMON - BHATTACHARYA TANMOY - FISCHER WILLIAM M. - THEILER JAMES - YUSIM KARINA - KUIKEN CARLA - ,LOS ALAMOS NATIONAL SECURITY LLC - ,HUMAN IMMUNODEFICIENCY VIRUS TYPE 1 CLADE M MOSAIC GAG POLYPEPTIDES.,17-02-2012,13-09-2012,
ROPES & GRAY LLP,HART CELIA PATRICIA - HOLGATE ROBERT GEORGE EDWARD - JERMUTUS LUTZ ULRICH JOCHEN WILHELM - BUCHANAN CATRIONA LOUISE - DUNCAN ALEXANDER ROBERT - FINCH DONNA KIRSTY - ,CAMBRIDGE ANTIBODY TECHNOLOGY LIMITED - ,ANTIBODIES TO TGF-BETA,21-10-2013,08-05-2014,
ANDREW B. ULMER,ITE LLC - ,ETHICON ENDO-SURGERY INC. - ,INFLATOR FOR DILATION OF ANATOMICAL PASSAGEWAY,09-09-2013,13-03-2014,
ROPES & GRAY LLP,CAMBRIDGE ANTIBODY TECHNOLOGY LIMITED - ,OPTEIN INC. - ,ANTIBODIES TO TGF-BETA,21-10-2013,08-05-2014,
ROPES & GRAY LLP,LEDBETTER STEVEN R. - ,GENZYME CORPORATION - ,ANTIBODIES TO TGF-BETA,21-10-2013,08-05-2014,
CONLEY ROSE P.C./MATTHEW R. MOSCICKI,SCHLUMBERGER TECHNOLOGY CORPORATION - ,INTELLISERV LLC - ,METHOD AND CONDUIT FOR TRANSMITTING SIGNALS,31-12-2012,23-05-2013,
INTERMOLECULAR INC.,XU YONGLI - ,INTERMOLECULAR INC. - GUARDIAN INDUSTRIES CORP. - ,Low-E Glazing Performance by Seed Structure Optimization,12-03-2013,18-09-2014,
BRUCE CROSBY,BIOSAFETY SYSTEMS INC - ,CROSBY BRUCE KELLY - ,METHOD OF DISINFECTING A BUILDING AIR SUPPLY,19-10-2004,20-04-2006,27-11-2007,
MCDONNELL BOEHNEN HULBERT & BERGHOFF LLP,DEVAUL RICHARD - TELLER ERIC - BIFFLE CLIFFORD L - WEAVER JOSHUA - ,GOOGLE INC. - ,Balloon Power Sources with a Buoyancy Trade-Off,20-08-2012,20-02-2014,
GERALD T. SHEKLETON,VUGTS JOHANNES JACOBUS ANTONIUS MARIA - ILLING IVAR - ,OPTELEC DEVELOPMENT B.V. - ,LOW VISION DEVICE AND METHOD FOR RECORDING AND DISPLAYING AN OBJECT ON A SCREEN,14-02-2014,14-08-2014,
B. J. SADOFF,HAYNES BARTON F. - ,DUKE UNIVERSITY - ,HUMAN IMMUNODEFICIENCY VIRUS TYPE 1 CLADE M MOSAIC GAG POLYPEPTIDES.,17-02-2012,13-09-2012,
SQUARE 1 BANK,SQUARE 1 BANK - ,NEATO ROBOTICS INC. - ,Localization and mapping system and method for a robotic device,01-09-2006,15-03-2007,09-07-2013,
SQUARE 1 BANK,SQUARE 1 BANK - ,NEATO ROBOTICS INC. - ,DISTANCE SENSOR SYSTEM AND METHOD,19-07-2007,04-02-2010,
SQUARE 1 BANK,SQUARE 1 BANK - ,NEATO ROBOTICS INC. - ,METHOD AND APPARATUS FOR SIMULTANEOUS LOCALIZATION AND MAPPING OF MOBILE ROBOT ENVIRONMENT,31-08-2010,07-04-2011,
SQUARE 1 BANK,SQUARE 1 BANK - ,NEATO ROBOTICS INC. - ,MULTI-FUNCTION ROBOTIC DEVICE,01-09-2006,15-03-2007,30-06-2009,
ADE & COMPANY INC.,PERMATOOTH INC. - ,GRIJALVA KELLY - SIEGMUND MARILYN KATHLEEN - ,Dental Replacement Mounting System,24-04-2014,09-10-2014,
PERKINS COIE LLP,CIRELLI FRANCO - KENNEDY ROSS - TACHIKI SCOTT - ,SEATSUB INC. - ,DISTRIBUTING THINGS THROUGH PERSONALIZED NETWORKS,05-06-2008,18-10-2011,
STERNE KESSLER GOLDSTEIN & FOX PLLC,KORMAN ALAN J. - SRINIVASAN MOHAN - WANG CHANGYU - SELBY MARK J. - CHEN BINGLIANG - CARDARELLI JOSEPHINE M. - ,MEDAREX INC. - ,METHODS FOR TREATING CANCER USING ANTI-PD-1 ANTIBODIES IN COMBINATION WITH ANTI-CTLA-4 ANTIBODIES,27-03-2014,31-07-2014,
STERNE KESSLER GOLDSTEIN & FOX PLLC,KORMAN ALAN J. - SRINIVASAN MOHAN - WANG CHANGYU - SELBY MARK J. - CHEN BINGLIANG - CARDARELLI JOSEPHINE M. - ,MEDAREX INC. - ,METHODS FOR TREATING CANCER USING ANTI-PD-1 ANTIBODIES,06-05-2014,06-11-2014,
STERNE KESSLER GOLDSTEIN & FOX PLLC,KORMAN ALAN J. - SRINIVASAN MOHAN - WANG CHANGYU - SELBY MARK J. - CHEN BINGLIANG - CARDARELLI JOSEPHINE M. - ,MEDAREX INC. - ,MONOCLONAL ANTIBODIES TO PROGRAMMED DEATH 1 (PD-1),15-08-2011,23-05-2013,15-07-2014,
LEWIS ROCA ROTHGERBER LLP,CRAY RESEARCH INC. - ,CRAY RESEARCH L.L.C. - ,SPACIAL DERIVATIVE BUS ENCODER AND DECODER,13-06-2002,17-04-2003,23-01-2007,
SMITH RISLEY TEMPEL SANTOS LLC,DVORKIN LEV - ,HIGHCON SYSTEMS LTD - ,METHOD AND APPARATUS FOR LASER CUTTING,18-04-2013,24-10-2013,
CANON KABUSHIKI KAISHA,SANNO MASATO - ,CANON KABUSHIKI KAISHA - ,IMAGE PROCESSING APPARATUS IMAGE PROCESSING METHOD IMAGE PROCESSING PROGRAM AND IMAGING APPARATUS,24-06-2014,08-01-2015,
CANON KABUSHIKI KAISHA,MATSUNO KEISUKE - ,CANON KABUSHIKI KAISHA - ,REMOTE-CONTROL APPARATUS AND CONTROL METHOD THEREOF IMAGE CAPTURING APPARATUS AND CONTROL METHOD THEREOF AND SYSTEM,29-07-2014,05-02-2015,
GLOBUS MEDICAL INC.,GORDON JEFFREY DAVID - ,GLOBUS MEDICAL INC. - ,Device and Method for Treatment of Spinal Deformity,27-09-2013,03-04-2014,
AMY E. MANDRAGOURAS ESQ.,WILTON STEPHEN DONALD - FLETCHER SUE - MCCLOREY GRAHAM - ,THE UNIVERSITY OF WESTERN AUSTRALIA - ,ANTISENSE OLIGONUCLEOTIDES FOR INDUCING EXON SKIPPING AND METHODS OF USE THEREOF,27-06-2014,16-10-2014,
JAMES J. KERNELL,PATTON STEVEN - ,STABIL-LOC HOLDINGS LLC - ,CONCENTRICALLY LOADED ADJUSTABLE PIERING SYSTEM,18-06-2012,11-10-2012,07-10-2014,
BRIAN C. MEADOWS,BEHRENDT KIRK - DAUZVARDIS MATTHEW J. - HOCH RICHARD L. - ,CONSTAR INTERNATIONAL LLC - ,Oxygen Scavenging Compositions Articles Containing Same and Methods of Their Use,30-04-2013,31-10-2013,
YOUNG & THOMPSON,FIELD ROBERT SHAUN - HOWE GEOFFREY STUART - LAMBERT SIMON - ,JOHNSON MATTHEY PLC - ,RADIATION DETECTOR,12-02-2014,26-06-2014,
ZHI-XIANG (ALEX) OH,AUTOMATED SPEED TECHNOLOGIES LLC - ,AMERICAN TRAFFIC SOLUTIONS INC. - ,MULTIPLE OBJECT SPEED TRACKING SYSTEM,17-12-2009,08-07-2010,09-10-2012,
K. KEVIN MUN,SAMSUNG SDI CO. LTD. - ,INTELLECTUAL KEYSTONE TECHNOLOGY LLC - ,COLOR DISPLAY DEVICE,22-02-2000,14-05-2002,
CONLEY ROSE P.C./MATTHEW R. MOSCICKI,BIESTER KLAUS - KUNOW PETER - ,COOPER CAMERON CORPORATION - ,ELECTRIC CONTROL AND SUPPLY SYSTEM,16-09-2013,16-01-2014,
BERNARD F. PLANTZ,DEPUY SYNTHES PRODUCTS LLC - ,DEPUY SYNTHES PRODUCTS INC. - ,MOBILE BEARING HIP ASSEMBLY HAVING DECOUPLED MOTION ALONG MULTIPLE AXES,30-03-2012,03-10-2013,08-07-2014,
CONLEY ROSE P.C./MATTHEW R. MOSCICKI,LENZ NORBERT - ,COOPER CAMERON CORPORATION - ,ELECTRIC CONTROL AND SUPPLY SYSTEM,16-09-2013,16-01-2014,
ALFREDO VILLANUEVA,TENSOLITE LLC - ELECTRONIC SPECIALISTS INC. - CARLYLE INC. - ,CARLISLE INTERCONNECT TECHNOLOGIES INC. - ,INSULATING SHEATH FOR RETAINING CONTACTS IN AN ELECTRICAL CONNECTOR AND RELATED ASSEMBLY METHOD,30-06-2014,23-10-2014,
B. J. SADOFF,KORBER BETTE T. - PERKINS SIMON - BHATTACHARYA TANMOY - FISCHER WILLIAM M. - THEILER JAMES - YUSIM KARINA - KUIKEN CARLA - ,THE REGENTS OF THE UNIVERSITY OF CALIFORNIA - ,HUMAN IMMUNODEFICIENCY VIRUS TYPE 1 CLADE M MOSAIC GAG POLYPEPTIDES.,17-02-2012,13-09-2012,
DIRECTOR DEITR,THE BOARD OF TRUSTEES OF THE LELAND STANFORD JUNIOR UNIVERSITY - ,NATIONAL INSTITUTES OF HEALTH (NIH) U.S. DEPT. OF HEALTH AND HUMAN SERVICES (DHHS) U.S. GOVERNMENT - ,OPTOGENETIC MAGNETIC RESONANCE IMAGING,20-03-2013,31-10-2013,16-09-2014,
DIRECTOR DEITR,THE BOARD OF TRUSTEES OF THE LELAND STANFORD JUNIOR UNIVERSITY - ,NATIONAL INSTITUTES OF HEALTH (NIH) U.S. DEPT. OF HEALTH AND HUMAN SERVICES (DHHS) U.S. GOVERNMENT - ,METHODS AND COMPOSITIONS FOR IDENTIFYING AGENTS THAT INHIBIT AN NS4B-MEDIATED NEOPLASTIC CELLULAR PHENOTYPE OF HCV INFECTED CELLS,20-06-2008,26-03-2009,28-10-2014,
MERCK SHARP & DOHME CORP,SCHERING-PLOUGH ANIMAL HEALTH CORPORATION - ,INTERVET INC. - ,PHARMACEUTICAL COMPOSITIONS AND METHOD FOR TREATING INFLAMMATION IN CATTLE AND OTHER ANIMALS,18-12-2007,26-06-2008,
HODGSON RUSS LLP,CENOVOUS ENERGY INC. - ,FCCL PARTNERSHIP - ,Heat Exchanger Descaling System Using Blowdown,26-12-2013,03-07-2014,
DIRECTOR DEITR,THE BOARD OF TRUSTEES OF THE LELAND STANFORD JUNIOR UNIVERSITY - ,NATIONAL INSTITUTES OF HEALTH (NIH) U.S. DEPT. OF HEALTH AND HUMAN SERVICES (DHHS) U.S. GOVERNMENT - ,IRE1ALPHA ENDONUCLEASE SPECIFIC INHIBITOR WITH CYTOTOXIC ACTIVITY,25-07-2013,14-11-2013,
BACON & THOMAS PLLC,JAPAN SURFACE TREATMENT INSTITUTE CO. LTD. - ,KANTO GAKUIN SCHOOL CORPORATION - ,MATERIAL FOR FORMING ELECTROLESS PLATE COATING SOLUTION FOR ADHERING CATALYST METHOD FOR FORMING ELECTROLESS PLATE AND PLATING METHOD,31-07-2009,06-05-2010,05-03-2013,
BACON & THOMAS PLLC,JAPAN SURFACE TREATMENT INSTITUTE CO. LTD. - ,KANTO GAKUIN SCHOOL CORPORATION - ,MATERIAL FOR FORMING ELECTROLESS PLATE AND METHOD FOR FORMING ELECTROLESS PLATE USING THE SAME,04-09-2008,19-03-2009,26-06-2012,
B. J. SADOFF,THE REGENTS OF THE UNIVERSITY OF CALIFORNIA - ,LOS ALAMOS NATIONAL SECURITY LLC - ,HUMAN IMMUNODEFICIENCY VIRUS TYPE 1 CLADE M MOSAIC GAG POLYPEPTIDES.,17-02-2012,13-09-2012,
XU ZHANG,GAO YI - ,ABBOTT LABORATORIES - ,ANTI-VIRAL COMPOUNDS,14-02-2014,23-10-2014,
PERKINS COIE LLP,PARKER JON - ,NEVRO CORPORATION - ,PHYSICIAN PROGRAMMER WITH ENHANCED GRAPHICAL USER INTERFACE AND ASSOCIATED SYSTEMS AND METHODS,30-07-2014,05-02-2015,
ROBERT GREESON,MANETAKIS KONSTANTINOS - ,CAMBRIDGE SILICON RADIO LIMITED - ,POWER AMPLIFIER CIRCUIT,17-08-2012,20-02-2014,
DIRECTOR DEITR,CORNELL UNIVERSITY/CORNELL RESEARCH FOUNDATIONINC. - ,NATIONAL INSTITUTES OF HEALTH (NIH) U.S. DEPT. OF HEALTH AND HUMAN SERVICES (DHHS) U.S. GOVERNMENT - ,METHODS FOR TREATING IgE-MEDIATED DISORDER,23-09-2011,26-01-2012,09-09-2014,
JACOBSON HOLMAN PLLC,AERTS HANS - BERTRAND ERIC - BOISDENGHIEN ARNAUD - ,S.A. IMPERBEL N.V. - ,WERKWIJZE VOOR HET VERVAARDIGEN VAN EEN BINDMIDDELSAMENSTELLING,03-05-2013,23-01-2014,
THE LAW OFFICE OF MICHAEL E. KONDOUDIS,OPLON B.V. - ,OPLON PURE SCIENCE LTD - ,BIOCIDIC MEDICAL DEVICES IMPLANTS AND WOUND DRESSINGS,18-11-2009,08-04-2010,
BIRCH STEWART KOLASCH & BIRCH LLP,LG UPLUS CORP. - ,LG ELECTRONICS INC. - ,THREE-LEVEL PHOTOVOLTAIC INVERTER CONFIGURED FOR ASYMMETRIC CONTROL OF DC-LINK VOLTAGES FOR SEPARATE MPPT DRIVING,24-01-2013,10-04-2014,
DIRECTOR DEITR,WISCONSIN ALUMNI RESEARCH FOUNDATION - ,NATIONAL INSTITUTES OF HEALTH (NIH) U.S. DEPT. OF HEALTH AND HUMAN SERVICES (DHHS) U.S. GOVERNMENT - ,Coupled Axial and Lateral Displacement Estimation for Elasticity Imaging,13-10-2010,19-04-2012,30-12-2014,
TREVOR K. COPELAND,LAVELLE SHAY - DEVEREUX PAUL - CLANCY MICHAEL - ,COOK IRELAND LIMITED - ,FIDUCIAL DEPLOYMENT NEEDLE SYSTEM,13-08-2014,27-11-2014,
THE LAW OFFICE OF MICHAEL E. KONDOUDIS,OPLON B.V. - ,OPLON PURE SCIENCE LTD - ,BIOFILM DETERRENCE IN WATER SUPPLY SYSTEMS,19-11-2009,03-06-2010,
WOOD PHILLIPS KATZ CLARK & MORTIMER,UNIVERSITY OF UTAH - ,UNIVERSITY OF UTAH RESEARCH FOUNDATION - ,SUBSTITUTED (E)-N'-(1-PHENYLETHYLIDENE)BENZOHYDRAZIDE ANALOGS AS HISTONE DEMETHYLASE INHIBITORS,15-08-2012,03-04-2014,
MYERS BIGEL SIBLEY & SAJOVEC P.A.,MIMEDX INC. - ,MIMEDX GROUP INC. - ,COMPRESSIBLE TUBES FOR PLACING IMPLANTS AND RELATED MEDICAL KITS AND METHODS OF USING SAME,11-05-2011,17-11-2011,
SUGHRUE MION PLLC,NEC ACCESSTECHNICA LTD. - NEC INFRONTIA CORPORATION - ,NEC PLATFORMS LTD. - ,SHEET PRESENCE DETECTING APPARATUS IMAGE READING APPARATUS METHOD FOR DETECTING A SHEET PRESENCE AND METHOD FOR READING AN IMAGE IN A SHEET,22-07-2009,28-01-2010,08-01-2013,
SUGHRUE MION PLLC,NEC ACCESSTECHNICA LTD. - NEC INFRONTIA CORPORATION - ,NEC PLATFORMS LTD. - ,FEEDING APPARATUS ELECTRONIC APPARATUS INCLUDING FEEDING APPARATUS AND FEEDING METHOD,03-11-2010,09-06-2011,13-08-2013,
SUGHRUE MION PLLC,NEC ACCESSTECHNICA LTD. - NEC INFRONTIA CORPORATION - ,NEC PLATFORMS LTD. - ,SHEET FEEDING APPARATUS DOCUMENT READING APPARATUS AND METHOD FOR FEEDING SHEET,14-02-2011,01-09-2011,05-03-2013,
SUGHRUE MION PLLC,NEC ACCESSTECHNICA LTD. - NEC INFRONTIA CORPORATION - ,NEC PLATFORMS LTD. - ,NETWORK SYSTEM HOME GATEWAY CONTENT PLAYBACK METHOD AND RECORDING MEDIA FOR RECORDING A NETWORK MANAGEMENT PROGRAM,06-08-2013,28-11-2013,
SUGHRUE MION PLLC,NEC ACCESSTECHNICA LTD. - NEC INFRONTIA CORPORATION - ,NEC PLATFORMS LTD. - ,DISTANCE MEASURING METHOD DISTANCE MEASURING DEVICE USING SAME AND DISTANCE MEASURING STRUCTURE USING SAME,20-04-2004,27-01-2005,19-06-2007,
SUGHRUE MION PLLC,NEC ACCESSTECHNICA LTD. - NEC INFRONTIA CORPORATION - ,NEC PLATFORMS LTD. - ,INFORMATION TERMINAL POWER SAVING METHOD IN INFORMATION TERMINAL AND RECORDING MEDIUM WHICH RECORDS PROGRAM,23-07-2013,14-11-2013,
SUGHRUE MION PLLC,NEC ACCESSTECHNICA LTD. - NEC INFRONTIA CORPORATION - ,NEC PLATFORMS LTD. - ,WIRELESS COMMUNICATION USING COMMUNICATION RATE BASED ON RADIO SIGNAL PROPAGATION CONDITION,22-10-2008,30-04-2009,22-02-2011,
SUGHRUE MION PLLC,NEC ACCESSTECHNICA LTD. - NEC INFRONTIA CORPORATION - ,NEC PLATFORMS LTD. - ,DATA PROCESSING APPARATUS AND DATA TRANSFER METHOD,17-07-2008,29-01-2009,15-02-2011,
SUGHRUE MION PLLC,NEC ACCESSTECHNICA LTD. - NEC INFRONTIA CORPORATION - ,NEC PLATFORMS LTD. - ,ACCESS CONTROL DEVICE AND ACCESS CONTROL METHOD,22-10-2007,24-04-2008,13-04-2010,
SUGHRUE MION PLLC,NEC ACCESSTECHNICA LTD. - NEC INFRONTIA CORPORATION - ,NEC PLATFORMS LTD. - ,ORIGINAL DOCUMENT SIZE DETECTION DEVICE,15-08-2012,21-02-2013,21-01-2014,
SUGHRUE MION PLLC,NEC ACCESSTECHNICA LTD. - NEC INFRONTIA CORPORATION - ,NEC PLATFORMS LTD. - ,TIMING OF SYNCHRONIZING SIGNAL,25-01-2011,02-06-2011,02-09-2014,
SUGHRUE MION PLLC,NEC ACCESSTECHNICA LTD. - NEC INFRONTIA CORPORATION - ,NEC PLATFORMS LTD. - ,COMMUNICATION SYSTEM AND E-MAIL CHECK METHOD,13-03-2008,09-10-2008,13-03-2012,
SUGHRUE MION PLLC,NEC ACCESSTECHNICA LTD. - NEC INFRONTIA CORPORATION - ,NEC PLATFORMS LTD. - ,WIRELESS COMMUNICATION SYSTEM CONTROL APPARATUS COMMUNICATION METHOD SWITCHING METHOD AND PROGRAM,11-02-2011,03-11-2011,26-11-2013,
SUGHRUE MION PLLC,NEC ACCESSTECHNICA LTD. - NEC INFRONTIA CORPORATION - ,NEC PLATFORMS LTD. - ,CALL SIGNAL GENERATING DEVICE,09-05-2011,08-12-2011,04-03-2014,
SUGHRUE MION PLLC,NEC ACCESSTECHNICA LTD. - NEC INFRONTIA CORPORATION - ,NEC PLATFORMS LTD. - ,OPTICAL DEVICE IMAGE READING APPARATUS AND ADJUSTING METHOD FOR OPTICAL DEVICE,11-05-2009,12-11-2009,17-07-2012,
SUGHRUE MION PLLC,NEC ACCESSTECHNICA LTD. - NEC INFRONTIA CORPORATION - ,NEC PLATFORMS LTD. - ,IMAGE READING APPARATUS MOVING BODY FIXING STRUCTURE AND ELECTRONIC EQUIPMENT,10-04-2012,11-10-2012,28-01-2014,
SUGHRUE MION PLLC,NEC ACCESSTECHNICA LTD. - NEC INFRONTIA CORPORATION - ,NEC PLATFORMS LTD. - ,IMAGE PROCESSING DEVICE METHOD FOR PROCESSING IMAGE AND PROGRAM FOR PROCESSING IMAGE,06-12-2011,14-06-2012,01-10-2013,
SUGHRUE MION PLLC,NEC ACCESSTECHNICA LTD. - NEC INFRONTIA CORPORATION - ,NEC PLATFORMS LTD. - ,ROUTER DEVICE PACKET CONTROL METHOD BASED ON PREFIX MANAGEMENT AND PROGRAM,10-06-2013,03-10-2013,
SUGHRUE MION PLLC,NEC ACCESSTECHNICA LTD. - NEC INFRONTIA CORPORATION - ,NEC PLATFORMS LTD. - ,DATA DISTRIBUTION APPARATUS DATA DISTRIBUTION METHOD AND DISTRIBUTION CONTROL PROGRAM,10-10-2008,16-04-2009,29-04-2014,
SUGHRUE MION PLLC,NEC ACCESSTECHNICA LTD. - NEC INFRONTIA CORPORATION - ,NEC PLATFORMS LTD. - ,DEVICE HAVING ELECTRONIC COMPONENTS MOUNTED THEREIN AND METHOD FOR MANUFACTURING SUCH DEVICE,15-01-2010,29-07-2010,21-02-2012,
SUGHRUE MION PLLC,NEC ACCESSTECHNICA LTD. - NEC INFRONTIA CORPORATION - ,NEC PLATFORMS LTD. - ,IMAGE READING SYSTEM USING AN ANGLE ADJUSTMENT DEVICE,11-04-2012,02-08-2012,20-05-2014,
SUGHRUE MION PLLC,NEC ACCESSTECHNICA LTD. - NEC INFRONTIA CORPORATION - ,NEC PLATFORMS LTD. - ,IMAGE COMBINING DEVICE AND IMAGE COMBINING METHOD,12-03-2009,01-10-2009,24-06-2014,
SUGHRUE MION PLLC,NEC ACCESSTECHNICA LTD. - NEC INFRONTIA CORPORATION - ,NEC PLATFORMS LTD. - ,WIRELESS LAN TERMINAL A WIRELESS LAN SYSTEM A MAC ADDRESS LEARNING METHOD AND A COMPUTER PROGRAM PRODUCT,18-07-2008,29-01-2009,24-07-2012,
SUGHRUE MION PLLC,NEC ACCESSTECHNICA LTD. - NEC INFRONTIA CORPORATION - ,NEC PLATFORMS LTD. - ,EDGE DETECTING DEVICE ELECTRONIC EQUIPMENT AND EDGE DETECTING METHOD USING THE SAME,04-09-2008,12-03-2009,12-04-2011,
SUGHRUE MION PLLC,NEC ACCESSTECHNICA LTD. - NEC INFRONTIA CORPORATION - ,NEC PLATFORMS LTD. - ,MIRROR SUPPORT DEVICE AND IMAGE READER,04-08-2011,05-04-2012,
SUGHRUE MION PLLC,NEC ACCESSTECHNICA LTD. - NEC INFRONTIA CORPORATION - ,NEC PLATFORMS LTD. - ,ELECTRIC POWER PATH SWITCHING METHOD AND ELECTRIC POWER PATH SWITCHING CIRCUIT,01-09-2011,26-04-2012,
SUGHRUE MION PLLC,NEC ACCESSTECHNICA LTD. - NEC INFRONTIA CORPORATION - ,NEC PLATFORMS LTD. - ,ANTENNA DEVICE,19-04-2013,08-08-2013,
SUGHRUE MION PLLC,NEC ACCESSTECHNICA LTD. - NEC INFRONTIA CORPORATION - ,NEC PLATFORMS LTD. - ,WIRELESS COMMUNICATION SYSTEM ROUTER APPARATUS WIRELESS COMMUNICATION METHOD AND PROGRAM,08-02-2011,09-06-2011,14-05-2013,
SUGHRUE MION PLLC,NEC ACCESSTECHNICA LTD. - NEC INFRONTIA CORPORATION - ,NEC PLATFORMS LTD. - ,THREE-DIMENSIONALLY INTEGRATED SEMICONDUCTOR DEVICE AND ELECTRONIC DEVICE INCORPORATION BY REFERENCE,17-01-2012,19-07-2012,
SUGHRUE MION PLLC,NEC ACCESSTECHNICA LTD. - NEC INFRONTIA CORPORATION - ,NEC PLATFORMS LTD. - ,WIRELESS COMMUNICATION,29-11-2012,11-07-2013,
SUGHRUE MION PLLC,NEC ACCESSTECHNICA LTD. - NEC INFRONTIA CORPORATION - ,NEC PLATFORMS LTD. - ,INFORMATION MANAGEMENT APPARATUS INFORMATION MANAGEMENT SYSTEM INFORMATION MANAGEMENT METHOD AND PROGRAM,08-05-2012,15-11-2012,
SUGHRUE MION PLLC,NEC ACCESSTECHNICA LTD. - NEC INFRONTIA CORPORATION - ,NEC PLATFORMS LTD. - ,COMMUNICATION APPARATUS A FIREWALL CONTROL METHOD AND A FIREWALL CONTROL PROGRAM,29-01-2009,06-08-2009,07-08-2012,
SUGHRUE MION PLLC,NEC ACCESSTECHNICA LTD. - NEC INFRONTIA CORPORATION - ,NEC PLATFORMS LTD. - ,SEMICONDUCTOR DEVICE,30-08-2010,10-02-2011,25-12-2012,
SUGHRUE MION PLLC,NEC ACCESSTECHNICA LTD. - NEC INFRONTIA CORPORATION - ,NEC PLATFORMS LTD. - ,MULTIBAND ANTENNA AND MOBILE TERMINAL,21-05-2014,02-10-2014,
SUGHRUE MION PLLC,NEC ACCESSTECHNICA LTD. - NEC INFRONTIA CORPORATION - ,NEC PLATFORMS LTD. - ,ANTENNA AND MOBILE TERMINAL INCLUDING THE ANTENNA,15-03-2013,18-07-2013,
SUGHRUE MION PLLC,NEC ACCESSTECHNICA LTD. - NEC INFRONTIA CORPORATION - ,NEC PLATFORMS LTD. - ,LIGHT COLLECTING MEMBER AND OPTICAL MODULE AND IMAGE READING DEVICE HAVING THE LIGHT COLLECTING MEMBER,05-08-2013,06-02-2014,16-12-2014,
SUGHRUE MION PLLC,NEC ACCESSTECHNICA LTD. - NEC INFRONTIA CORPORATION - ,NEC PLATFORMS LTD. - ,AUTOMATIC DOCUMENT FEEDER,09-05-2011,19-01-2012,20-11-2012,
SUGHRUE MION PLLC,NEC ACCESSTECHNICA LTD. - NEC INFRONTIA CORPORATION - ,NEC PLATFORMS LTD. - ,MANAGEMENT DEVICE MANAGEMENT METHOD AND PROGRAM RECORDING MEDIUM,01-09-2011,15-03-2012,
SUGHRUE MION PLLC,NEC ACCESSTECHNICA LTD. - NEC INFRONTIA CORPORATION - ,NEC PLATFORMS LTD. - ,DOCUMENT CONVEYING APPARATUS AND DOCUMENT CONVEYING METHOD,27-06-2012,03-01-2013,03-06-2014,
SUGHRUE MION PLLC,NEC ACCESSTECHNICA LTD. - NEC INFRONTIA CORPORATION - ,NEC PLATFORMS LTD. - ,DATA OUTPUT ADJUSTMENT APPARATUS DATA OUTPUT ADJUSTMENT METHOD RGMII NETWORK SYSTEM AND RGMII NETWORK COMMUNICATION PATH CHANGE METHOD,01-06-2012,06-12-2012,09-09-2014,
SUGHRUE MION PLLC,NEC ACCESSTECHNICA LTD. - NEC INFRONTIA CORPORATION - ,NEC PLATFORMS LTD. - ,DOCUMENT COLOR DETERMINING APPARATUS IMAGE PROCESSING APPARATUS DOCUMENT COLOR DETERMINING METHOD AND COMPUTER READABLE MEDIUM STORED DOCUMENT COLOR DETERMINING PROGRAM,01-09-2010,03-03-2011,09-04-2013,
SUGHRUE MION PLLC,NEC ACCESSTECHNICA LTD. - NEC INFRONTIA CORPORATION - ,NEC PLATFORMS LTD. - ,HEAT CONDUCTION BOARD AND MOUNTING METHOD OF ELECTRONIC COMPONENTS,22-06-2010,19-05-2011,02-10-2012,
SUGHRUE MION PLLC,NEC ACCESSTECHNICA LTD. - NEC INFRONTIA CORPORATION - ,NEC PLATFORMS LTD. - ,VOLTAGE GENERATION APPARATUS AND VOLTAGE GENERATION METHOD,20-07-2012,31-01-2013,23-12-2014,
SUGHRUE MION PLLC,NEC ACCESSTECHNICA LTD. - NEC INFRONTIA CORPORATION - ,NEC PLATFORMS LTD. - ,METHOD OF MANUFACTURING A THREE-DIMENSIONAL PACKAGING SEMICONDUCTOR DEVICE,19-11-2012,28-03-2013,17-02-2015,
SUGHRUE MION PLLC,NEC ACCESSTECHNICA LTD. - NEC INFRONTIA CORPORATION - ,NEC PLATFORMS LTD. - ,RADIO LAN SYSTEM USING COMMUNICATION APPARATUS AND METHOD FOR SETTING OPERATION MODE,20-06-2007,27-12-2007,11-05-2010,
SUGHRUE MION PLLC,NEC ACCESSTECHNICA LTD. - NEC INFRONTIA CORPORATION - ,NEC PLATFORMS LTD. - ,RADIO COMMUNICATION TERMINAL METHOD FOR SELECTING COMMUNICATION CHANNEL AND COMPUTER-READABLE STORAGE MEDIUM,06-03-2009,09-09-2010,21-08-2012,
SUGHRUE MION PLLC,NEC ACCESSTECHNICA LTD. - NEC INFRONTIA CORPORATION - ,NEC PLATFORMS LTD. - ,DOCUMENT CONVEYING DEVICE AND DOCUMENT READING APPARATUS USING THE SAME,03-05-2010,30-12-2010,21-05-2013,
SUGHRUE MION PLLC,NEC ACCESSTECHNICA LTD. - NEC INFRONTIA CORPORATION - ,NEC PLATFORMS LTD. - ,COMMUNICATION TERMINAL,25-01-2011,26-05-2011,
SUGHRUE MION PLLC,NEC ACCESSTECHNICA LTD. - NEC INFRONTIA CORPORATION - ,NEC PLATFORMS LTD. - ,PAPER AUTOMATIC-FEEDING APPARATUS COPYING MACHINE AND FACSIMILE APPARATUS,04-08-2011,29-03-2012,16-04-2013,
SUGHRUE MION PLLC,NEC ACCESSTECHNICA LTD. - NEC INFRONTIA CORPORATION - ,NEC PLATFORMS LTD. - ,COMMUNICATION TERMINAL APPARATUS AND FACSIMILE COMMUNICATION METHOD,24-09-2007,27-03-2008,09-04-2013,
SUGHRUE MION PLLC,NEC ACCESSTECHNICA LTD. - NEC INFRONTIA CORPORATION - ,NEC PLATFORMS LTD. - ,POSITION SEARCH SYSTEM A MOBILE INFORMATION TERMINAL A POSITION SEARCH METHOD AND A RECORDING MEDIUM WHICH RECORDS A POSITION SEARCH PROGRAM,19-06-2013,10-10-2013,
SUGHRUE MION PLLC,NEC ACCESSTECHNICA LTD. - NEC INFRONTIA CORPORATION - ,NEC PLATFORMS LTD. - ,Image compression unit image decompression unit and image processing system,13-10-2009,13-05-2010,14-08-2012,
TREVOR K. COPELAND,COOK IRELAND LIMITED - ,COOK MEDICAL TECHNOLOGIES LLC - ,FIDUCIAL DEPLOYMENT NEEDLE SYSTEM,13-08-2014,27-11-2014,
WENDEROTH LIND & PONACK LLP,MITSUBISHI HEAVY INDUSTRIES LTD. - ,MITSUBISHI HITACHI POWER SYSTEMS LTD. - ,MULTISTAGE PRESSURE CONDENSER AND STEAM TURBINE PLANT EQUIPPED WITH THE SAME,22-09-2011,30-08-2012,
WENDEROTH LIND & PONACK LLP,MITSUBISHI HEAVY INDUSTRIES LTD. - ,MITSUBISHI HITACHI POWER SYSTEMS LTD. - ,TURBINE EXTERNAL COMPARTMENT FRAME FOR TURBINE EXTERNAL COMPARTMENT AND METHOD OF CONSTRUCTING FRAME FOR TURBINE EXTERNAL COMPARTMENT,26-03-2013,11-07-2013,
WENDEROTH LIND & PONACK LLP,MITSUBISHI HEAVY INDUSTRIES LTD. - ,MITSUBISHI HITACHI POWER SYSTEMS LTD. - ,COOLNG STRUCTURE FOR RECOVERY-TYPE AIR-COOLED GAS TURBINE COMBUSTOR,21-12-2012,25-04-2013,
WENDEROTH LIND & PONACK LLP,MITSUBISHI HEAVY INDUSTRIES LTD. - ,MITSUBISHI HITACHI POWER SYSTEMS LTD. - ,BURNER REACTION FURNACE SUCH AS GASIFICATION FURNACE INCLUDING THE BURNER AND POWER PLANT INCLUDING THE REACTION FURNACE,23-04-2013,12-09-2013,
WENDEROTH LIND & PONACK LLP,MITSUBISHI HEAVY INDUSTRIES LTD. - ,MITSUBISHI HITACHI POWER SYSTEMS LTD. - ,IGNITION TORCH AND PRESSURIZED GASIFICATION FURNACE INCLUDING THE SAME,07-02-2013,06-06-2013,
WENDEROTH LIND & PONACK LLP,MITSUBISHI HEAVY INDUSTRIES LTD. - ,MITSUBISHI HITACHI POWER SYSTEMS LTD. - ,TURBINE-BLADE RETAINING STRUCTURE AND ROTARY MACHINE HAVING THE SAME,28-01-2013,29-08-2013,
